owner,repo,github_stars,download_count,experimental_ai_generated_description,risk_category,adjusted_risk_score,popularity_score,doc_quality_score,doc_quality_adjustment,readme_found,has_installation_docs,has_usage_docs,has_api_reference,has_security_docs,has_error_handling,has_cli_docs,has_code_examples,has_screenshots,has_license_info,readme_size_bytes,headings_count,code_blocks_count,readability_score,missing_sections,oauth_implementation,direct_api_tokens,main_risk_factors,outbound_connections
wshobson,mcp-trader,86,0,"This MCP trader server, developed by Seth Hobson, provides technical analysis capabilities for stock traders. It integrates with the Tiingo API to fetch financial data and leverages libraries like pandas and TA-Lib to perform comprehensive technical analysis on stocks. The server offers a single 'analyze-stock' tool that takes a stock symbol and returns key technical indicators including moving averages, momentum oscillators, and volume metrics. Built with Python and designed to run as a local MCP server, it's particularly useful for AI assistants or applications needing to generate detailed technical analysis reports or make data-driven trading recommendations based on current market data.",MINIMAL,0.73,1.0,7.8,-2.34,Yes,Yes,Yes,Yes,Yes,Yes,Yes,Yes,Yes,Yes,8610,26,12,5.0,,No,Yes,,https://api.tiingo.com/tiingo/daily/{symbol; http://localhost:8000/call-tool
run-llama,llamacloud-mcp,86,0,"LlamaCloud MCP server provides a tool for querying LlamaIndex documentation through RAG (Retrieval-Augmented Generation) using the LlamaCloud managed index service. Developed by Laurie Voss, this implementation connects to a pre-configured LlamaCloud index containing LlamaIndex documentation and uses it to answer queries with detailed responses including code examples. The server requires a LlamaCloud API key and optionally an OpenAI API key for powering the RAG queries, making it ideal for developers who need up-to-date access to LlamaIndex documentation within their AI assistant workflows.",MINIMAL,0.68,1.0,5.9,-1.77,Yes,Yes,Yes,Yes,Yes,No,Yes,Yes,Yes,No,5204,9,7,5.0,error_handling; license; project_info,No,Yes,,
yuchenssr,mindmap-mcp-server,86,6333,"Mindmap-MCP-Server provides a bridge between Markdown content and interactive mind maps using the markmap-cli tool. Built by YuChenSSR, this server exposes a single tool that converts Markdown text into HTML-based mind maps, with options to return either the complete HTML content or just the file path to the generated visualization. The implementation handles temporary file creation, subprocess management for the markmap-cli tool, and proper error handling. It's particularly useful for workflows that involve visualizing structured content, organizing thoughts, or creating interactive knowledge maps directly within Claude conversations.",MINIMAL,1.17,1.4,7.8,-2.34,Yes,Yes,Yes,Yes,Yes,Yes,Yes,Yes,Yes,Yes,7441,23,10,5.0,,No,No,,
supercurses,powerpoint,86,0,"The server implements multiple tools:

create-presentation: Starts a presentation
Takes ""name"" as required string arguments
Creates a presentation object
add-slide-title-only: Adds a title slide to the presentation
Takes ""presentation_name"" and ""title"" as required string arguments
Creates a title slide with ""title"" and adds it to presentation
add-slide-title-content: Adds a title with content slide to the presentation
Takes ""presentation_name"", ""title"", ""content"" as required string arguments
Creates a title with content slide with ""title"" and ""content"" and adds it to presentation
add-slide-title-with-table: Adds a title slide with a table
Takes ""presentation_name"", ""title"", ""data"" as required string and array arguments
Creates a title slide with ""title"" and adds a table dynamically built from data
add-slide-title-with-chart: Adds a title slide with a chart
Takes ""presentation_name"", ""title"", ""data"" as required string and object arguments
Creates a title slide with ""title"" and adds a chart dynamically built from data. Attempts to figure out the best type of chart from the data source.
add-slide-picture-with-caption: Adds a picture with caption slide
Takes ""presentation_name"", ""title"", ""caption"", ""image_path"" as required string arguments
Creates a picture with caption slide using the supplied ""title"", ""caption"", and ""image_path"". Can either use images created via the ""generate-and-save-image"" tool or use an ""image_path"" supplied by the user (image must exist in folder_path)
open-presentation: Opens a presentation for editing
Takes ""presentation_name"" as required arguments
Opens the given presentation and automatically saves a backup of it as ""backup.pptx""
This tool allows the client to work with existing pptx files and add slides to them. Just make sure the client calls ""save-presentation"" tool at the end.
save-presentation: Saves the presentation to a file.
Takes ""presentation_name"" as required arguments.
Saves the presentation to the folder_path. The client must call this tool to finalize the process.
generate-and-save-image: Generates an image for the presentation using a FLUX model
Takes ""prompt"" and ""file_name"" as required string arguments
Creates an image using the free FLUX model on TogetherAI (requires an API key)",MINIMAL,0.7,1.0,6.5,-1.95,Yes,Yes,Yes,Yes,Yes,No,Yes,Yes,Yes,Yes,5062,11,21,5.0,error_handling,No,Yes,,
context-hub,generator,85,0,"Context Generator is a PHP-based tool for creating structured documentation from various sources including files, GitHub repositories, Git diffs, and URLs. It features a modular architecture with a powerful configuration system that supports imports, variables, and custom modifiers to transform content. The implementation includes an MCP server component that exposes prompts and tools for AI assistants to interact with the filesystem, retrieve project structure, and execute custom commands. Particularly useful for generating comprehensive code documentation, analyzing changes in projects, and providing context for AI-assisted development workflows.",MINIMAL,0.72,1.0,7.5,-2.25,Yes,Yes,Yes,Yes,Yes,Yes,Yes,Yes,Yes,Yes,8067,13,5,3.5,,No,Yes,,
kaliaboi,mcp-zotero,85,2405,"This Zotero MCP server, developed by Abhishek Kalia, provides AI assistants with a standardized interface to interact with Zotero libraries. Built using TypeScript and leveraging the Zotero API client, it offers capabilities for listing collections, retrieving item details, searching libraries, and fetching recently added papers. The server abstracts Zotero API authentication and request handling, enabling seamless integration with AI systems. It's particularly valuable for researchers and academics working with AI assistants, facilitating use cases such as literature reviews, citation management, and research organization within the Zotero ecosystem.",MINIMAL,0.91,1.2,6.9,-2.07,Yes,Yes,No,Yes,Yes,Yes,Yes,Yes,Yes,Yes,2514,5,9,5.0,usage,No,Yes,,
metatool-ai,mcp-server-metamcp,85,11629,"This MCP server implementation manages multiple MCPs through a centralized interface, streamlining AI assistant interactions across various platforms. Developed by James Zhang, it utilizes TypeScript and integrates with the Model Context Protocol SDK. The server focuses on secure API key management and provides a unified access point for multiple MCP services. It's designed for scalability and easy configuration, making it particularly useful for applications that need to coordinate multiple AI assistants or integrate diverse AI services. The implementation supports Docker deployment and is optimized for production environments, offering a robust solution for complex AI orchestration scenarios.",MINIMAL,1.39,1.6,6.9,-2.07,Yes,Yes,Yes,Yes,Yes,No,Yes,Yes,Yes,Yes,4935,17,9,3.5,error_handling,Yes,Yes,,
thrashr888,terraform-mcp-server,85,8364,"This MCP server implementation provides tools for interacting with the Terraform Registry API, enabling AI agents to query provider information, resource details, module metadata, and generate example configurations. Developed by Paul Thrasher, it offers functionalities such as provider lookup, resource usage examples, module recommendations, data source lookup, and schema details retrieval. Built with TypeScript and leveraging the Model Context Protocol SDK, the server is particularly useful for AI applications that need to automate Terraform-related tasks, assist in infrastructure-as-code development, or provide intelligent suggestions for Terraform configurations.",MINIMAL,1.18,1.4,7.4,-2.22,Yes,Yes,Yes,Yes,Yes,Yes,Yes,Yes,Yes,Yes,7475,15,3,3.5,,Yes,Yes,,
biegehydra,bifrostmcp,84,0,This MCP server implementation provides C# language features via the Model Context Protocol. It integrates with the C# extension for Visual Studio Code and exposes capabilities like finding symbol references across a codebase. The server runs on port 8003 and is designed to enhance AI-assisted coding workflows for C# projects.,MINIMAL,0.77,1.0,7.8,-2.34,Yes,Yes,Yes,Yes,Yes,Yes,Yes,Yes,Yes,Yes,9181,27,10,5.0,,No,No,,
jfrog,mcp-jfrog,84,0,"JFrog MCP Server provides a bridge to the JFrog Platform, enabling AI assistants to interact with Artifactory repositories, builds, security scanning, and release management. Developed by JFrog LTD, this TypeScript implementation exposes over 20 specialized tools for operations like repository creation, build tracking, package vulnerability scanning, and release bundle distribution. The server authenticates via JFrog access tokens and handles errors gracefully with detailed messages. Particularly valuable for DevOps teams and developers who want to leverage AI assistants for artifact management, security analysis, and release automation without switching context to the JFrog web interface.",MINIMAL,0.29,1.0,7.1,-2.13,Yes,Yes,Yes,Yes,Yes,No,Yes,Yes,Yes,Yes,13982,17,8,3.5,error_handling,Yes,No,,
pskill9,website-downloader,84,0,"This website downloader MCP server, developed by an unnamed author, provides a tool for downloading entire websites using wget. Built with TypeScript and leveraging the Model Context Protocol SDK, it offers functionality to recursively download web pages, preserve site structure, and convert links for local viewing. The server implements depth control, domain restriction, and file extension handling. By abstracting the complexities of website archiving, it enables AI systems to easily capture and analyze web content offline. This implementation is particularly valuable for applications requiring local copies of websites, facilitating use cases such as web archiving, offline content analysis, and website migration or backup tasks.",MINIMAL,0.81,1.0,6.2,-1.86,Yes,Yes,Yes,Yes,No,No,Yes,Yes,Yes,No,2048,11,6,5.0,error_handling; license,No,No,,
sirmews,apple-notes-mcp,84,16409,"This Apple Notes MCP server, developed by sirmews, enables access and and search of local Apple Notes databases. It provides tools for retrieving all notes, reading specific notes, and performing searches across note content. Built in Python, the implementation exposes Apple Notes data via a standardized MCP interface, allowing Claude to analyze and interact with personal note collections. By bridging AI models with Apple's native note-taking app, this server enhances Claude's ability to process personal information, assist with note organization, and augment information retrieval from Apple Notes. It is particularly useful for users seeking AI-powered knowledge management and research assistance within their existing Apple Notes ecosystem.",MINIMAL,1.41,1.6,6.3,-1.89,Yes,Yes,No,No,Yes,Yes,Yes,Yes,Yes,Yes,3474,15,8,5.0,usage; api_reference,No,No,,
jordyzomer,codeql-mcp,82,0,"CodeQL MCP Server provides a bridge to the CodeQL static analysis engine, enabling AI assistants to analyze codebases for security vulnerabilities and quality issues. The implementation offers tools for registering CodeQL databases, evaluating queries against codebases, decoding query results, and performing quick evaluations of specific classes or predicates. Built with Python using the FastMCP framework, it exposes a simple API that handles the complexities of CodeQL operations while providing structured results that can be easily interpreted by language models. This server is particularly valuable for security researchers and developers who want to leverage AI assistants for code analysis without directly interacting with the CodeQL CLI.",MINIMAL,0.86,1.0,4.8,-1.44,Yes,Yes,No,No,No,No,Yes,Yes,Yes,No,1541,7,4,5.0,usage; api_reference; error_handling; license,No,No,,
mhyrr,sketchup-mcp,82,0,"SketchupMCP connects Sketchup to Claude AI through a bidirectional TCP socket connection, enabling AI-assisted 3D modeling and scene manipulation. Built with Python and Ruby, it provides tools for creating, modifying, and transforming components, applying materials, inspecting scenes, and executing Ruby code directly in Sketchup. The implementation includes both a Sketchup extension that creates a TCP server within the application and a Python MCP server that handles the protocol communication, making it ideal for users who want to leverage AI capabilities for architectural design, interior modeling, or general 3D content creation without leaving their conversation interface.",MINIMAL,0.8,1.0,6.8,-2.04,Yes,Yes,Yes,Yes,No,Yes,Yes,Yes,Yes,Yes,3790,16,2,3.5,,No,No,,
richardhan,mssql_mcp_server,81,0,"This MCP server implementation, developed by Dana K. Williams, provides secure interaction with Microsoft SQL Server databases. Built with Python and leveraging libraries like mcp and pymssql, it offers a bridge between AI assistants and SQL Server data. The implementation focuses on security, with detailed guidance on creating restricted SQL logins, implementing row-level security, and following best practices for monitoring and auditing. It's particularly useful for organizations needing to integrate SQL Server data into AI workflows while maintaining strict security controls, enabling tasks like data analysis, reporting, and database management through AI interfaces while ensuring data protection and compliance.",MINIMAL,0.78,1.0,7.5,-2.25,Yes,Yes,Yes,Yes,Yes,Yes,Yes,Yes,Yes,Yes,3154,18,5,5.0,,No,No,,
inditextech,mcp-teams-server,81,0,"MCP Teams Server provides integration with Microsoft Teams, enabling AI assistants to interact with Teams channels through a standardized protocol. Developed by InditexTech, this Python implementation allows reading messages, creating threads, replying to messages, and mentioning team members. The server connects to Teams using Azure bot credentials and exposes functionality through a Docker container or local installation. It's particularly valuable for collaborative workflows where AI assistants need to monitor team communications, post updates to channels, or participate in threaded discussions without requiring users to switch contexts.",MINIMAL,0.78,1.0,7.2,-2.16,Yes,Yes,Yes,Yes,Yes,No,Yes,Yes,Yes,Yes,4832,15,8,3.5,error_handling,No,No,,
isaacphi,mcp-gdrive,81,4044,"This Google Drive MCP server, developed by Phil Isaac, enables seamless integration of Google Drive and Sheets functionality into AI-assisted workflows. Built with TypeScript and leveraging the @modelcontextprotocol/sdk, it provides a standardized interface for accessing and manipulating Google Drive files and Sheets data through Claude Desktop and compatible MCP clients. The implementation supports file listing, reading, and writing operations, as well as specialized tools for interacting with Google Sheets. It's particularly useful for developers and businesses looking to incorporate on-demand access to cloud-stored documents and spreadsheets into their AI-assisted applications, allowing for dynamic querying and manipulation of Google Drive content.",MINIMAL,0.99,1.2,6.4,-1.92,Yes,Yes,Yes,Yes,Yes,No,Yes,Yes,Yes,Yes,4876,8,2,3.5,error_handling,Yes,Yes,Found pattern: tracking; Suspicious network connection to datatracker.ietf.org,http://dicom.nema.org/medical/dicom/current/output/html/part18.html#sect_10.6; https://developer.mozilla.org/docs/Web/API/CanvasRenderingContext2D/textBaseline; https://developer.mozilla.org/docs/Web/API/Location/href; https://developer.mozilla.org/docs/Web/API/WebGL2RenderingContext/getTransformFeedbackVarying; https://developer.mozilla.org/docs/Web/API/IDBKeyRange/upperOpen
v-3,notion-server,81,0,"This Notion MCP server, developed by v-3, enables AI assistants to seamlessly interact with Notion workspaces through standardized tools for searching, reading, creating, and updating pages. It provides a simplified interface for complex Notion operations, making it easier for AI systems to manage and retrieve information from Notion databases and pages. The server stands out by offering a streamlined integration between AI capabilities and Notion's collaborative workspace features. It empowers AI assistants to handle tasks like knowledge management, note-taking, project tracking, and content creation within Notion. This implementation is particularly useful for applications that require AI-driven content organization, team collaboration tools, or any scenario where an AI system needs to work with structured data in a Notion workspace.",MINIMAL,0.73,1.0,7.6,-2.28,Yes,Yes,Yes,Yes,Yes,Yes,Yes,Yes,Yes,Yes,4313,24,10,5.0,,No,Yes,,
ozamatash,deep-research-mcp,80,0,"This open-source AI-powered research assistant performs iterative, deep research on any topic by combining search engines, web scraping, and large language models. It is available as a Model Context Protocol (MCP) tool for seamless integration with AI agents. The implementation focuses on simplicity, keeping the codebase under 500 lines of code for easy understanding and extensibility. It features intelligent query generation, depth and breadth control, smart follow-up questions, and comprehensive markdown reports. The tool is designed for efficient concurrent processing and can be used standalone or integrated into larger AI systems for in-depth, multi-level research tasks.",MINIMAL,0.71,1.0,7.1,-2.13,Yes,Yes,Yes,Yes,Yes,No,Yes,Yes,Yes,Yes,3655,12,8,5.0,error_handling,No,Yes,,
sammcj,mcp-package-version,80,12290,"This MCP server, developed by sammcj, provides AI assistants with up-to-date package version information for npm and PyPI registries. Built with TypeScript, it offers tools to check latest stable versions for individual packages or bulk queries across both ecosystems. The implementation stands out by integrating directly with public registries and providing flexible version range options for different use cases. By connecting AI capabilities with real-time package data, this server enables AI systems to recommend and use current, compatible dependencies when writing or reviewing code. It is particularly useful for maintaining project dependencies, ensuring security compliance, and automating dependency updates in software development workflows.",MINIMAL,1.39,1.6,7.0,-2.1,Yes,Yes,Yes,Yes,No,No,Yes,Yes,Yes,Yes,9349,23,21,5.0,error_handling,No,No,,
delano,postman-mcp-server,79,0,"This Postman MCP server, developed by Delano, provides AI assistants with programmatic access to Postman's API management platform. It integrates with the Postman API to enable functionalities like managing collections, environments, and APIs. The server is built with TypeScript and leverages the @modelcontextprotocol/sdk for MCP implementation. By abstracting Postman interactions, it allows AI systems to automate API testing, documentation, and workflow management. This implementation is particularly useful for developers, QA engineers, and API designers who want to leverage AI capabilities for API lifecycle management, automated testing, and collaborative API development workflows.",MEDIUM,-0.07,1.0,7.8,-2.34,Yes,Yes,Yes,Yes,Yes,Yes,Yes,Yes,Yes,Yes,10518,29,10,5.0,,Yes,Yes,Found pattern: send.*data; Found pattern: collect.*data; Suspicious domain: datatracker.ietf.org; Potential data exfiltration: send.*data,https://support.postman.com/; https://learning.postman.com/docs/collaborating-in-postman/using-workspaces/partner-workspaces/; https://learning.postman.com/docs/api-governance/api-definition/api-definition-warnings/; https://learning.postman.com/docs/collaborating-in-postman/roles-and-permissions/#collection-roles; https://learning.postman.com/docs/collaborating-in-postman/using-version-control/reviewing-pull-requests/
egoist,ffmpeg-mcp,78,1133,"ffmpeg-mcp is a stdio MCP server that provides a standardized interface for common media operations using FFmpeg. Developed by egoist and sponsored by ChatWise, this implementation allows AI assistants to perform video and audio processing tasks like speeding up videos and extracting audio from video files. The server acts as a bridge between natural language commands and FFmpeg's command-line interface, making media manipulation accessible through simple tool calls without requiring users to understand complex FFmpeg syntax.",MINIMAL,1.07,1.2,4.2,-1.26,Yes,Yes,Yes,No,No,No,Yes,Yes,No,Yes,623,4,2,3.5,api_reference; error_handling; project_info,No,No,,
sparfenyuk,mcp-telegram,78,0,"This MCP implementation for Telegram, developed by Sergey Parfenyuk, provides a server interface to interact with Telegram through the MTProto protocol. Built with Python and leveraging libraries like Telethon and Pydantic, it offers tools for listing dialogs and messages. The implementation focuses on providing a standardized way to access Telegram functionality through MCP, making it easier to integrate Telegram capabilities into AI workflows. It's particularly useful for developers and researchers looking to incorporate Telegram messaging and data retrieval into their AI-assisted applications, enabling tasks like automated message analysis, chatbot integration, or social media monitoring.",MINIMAL,0.79,1.0,7.0,-2.1,Yes,Yes,No,Yes,Yes,Yes,Yes,Yes,Yes,Yes,6800,19,9,5.0,usage,No,No,,
utensils,mcp-nixos,78,8592,"MCP-NixOS provides a server for interacting with NixOS packages, system options, Home Manager configuration, and nix-darwin macOS configuration through standardized URL schemes. Developed by James Brink, this Python implementation features multi-level caching with filesystem persistence, detailed documentation integration, and support for advanced search capabilities including hierarchical paths and version filtering. The architecture separates concerns into cache, clients, contexts, resources, and tools components, making it ideal for developers seeking programmatic access to Nix ecosystem configuration options and package information through AI assistants.",MINIMAL,0.67,1.4,7.8,-2.34,Yes,Yes,Yes,Yes,Yes,Yes,Yes,Yes,Yes,Yes,14163,44,9,5.0,,Yes,No,,https://nix-community.github.io/home-manager/nix-darwin-options.xhtml; https://example.com/other; https://example.com/test/{i; https://example.com/test; https://nix-community.github.io/home-manager/options.xhtml
weidwonder,crawl4ai-mcp-server,78,0,"This MCP server, developed by WeiDwonder, provides integration with Google Custom Search Engine for web crawling and search capabilities. Built with Python and leveraging libraries like Playwright and BeautifulSoup, it offers tools for automated web scraping, content extraction, and search result parsing. The implementation focuses on providing a standardized interface for AI-powered web crawling, enabling use cases such as data collection, content aggregation, and search engine development. By connecting AI models with Google's search infrastructure, this server allows for sophisticated web crawling scenarios, enhancing the ability to gather and analyze online information at scale.",MINIMAL,0.67,1.0,5.8,-1.74,Yes,Yes,Yes,Yes,Yes,No,Yes,Yes,Yes,Yes,3578,21,12,3.5,error_handling; project_info,No,Yes,,
illuminaresolutions,n8n-mcp-server,77,1771,"n8n MCP Server provides a bridge between Claude and n8n automation workflows through the Model Context Protocol. Developed by Illuminare Solutions, it enables AI assistants to list, create, update, and execute n8n workflows directly within conversations, along with managing credentials, tags, executions, and generating security audits. The implementation supports both core features available to all n8n users and Enterprise-specific capabilities like project and variable management, making it particularly valuable for teams who want to integrate their automation workflows with AI assistants without switching contexts.",MINIMAL,0.99,1.2,7.1,-2.13,Yes,Yes,No,Yes,Yes,Yes,Yes,Yes,Yes,Yes,3972,19,8,5.0,usage,Yes,Yes,,
integromat,make-mcp-server,77,4106,"Make MCP Server enables AI assistants to trigger and interact with Make automation workflows through the Model Context Protocol. Developed by Make, it connects to your Make account to identify on-demand scenarios, parse input parameters, allow AI assistants to invoke scenarios with appropriate parameters, and return structured JSON output. The server runs as a Node.js application that can be installed via npm or run in a Docker container, requiring a Make API key with scenarios:read and scenarios:run scopes. This implementation is particularly valuable for maintaining complex automation logic in Make while exposing functionality to AI systems, creating bidirectional communication between assistants and existing workflows.",MINIMAL,0.88,1.2,5.9,-1.77,Yes,Yes,Yes,Yes,Yes,No,Yes,Yes,Yes,No,1994,6,1,5.0,error_handling; license,No,Yes,,
