owner,repo,github_stars,download_count,experimental_ai_generated_description,risk_category,adjusted_risk_score,popularity_score,doc_quality_score,doc_quality_adjustment,readme_found,has_installation_docs,has_usage_docs,has_api_reference,has_security_docs,has_error_handling,has_cli_docs,has_code_examples,has_screenshots,has_license_info,readme_size_bytes,headings_count,code_blocks_count,readability_score,missing_sections,oauth_implementation,direct_api_tokens,main_risk_factors,outbound_connections
govcraft,rust-docs-mcp-server,65,0,"Rust documentation loader for the Model Context Protocol that efficiently processes HTML documentation files from Rust crates. Uses LlamaIndex's HTML reader to load and parse documentation, with intelligent file selection logic that handles duplicate files by selecting the largest version. Supports an optional 'dangerous' mode to include all HTML files, making it flexible for different documentation processing scenarios.",MINIMAL,0.78,1.0,7.3,-2.19,Yes,Yes,Yes,Yes,Yes,No,Yes,Yes,Yes,Yes,13933,21,7,5.0,error_handling,No,No,,
langfuse,mcp-server-langfuse,65,0,"This MCP server implementation provides access to Langfuse's prompt management capabilities, allowing users to list and retrieve prompts through the Model Context Protocol. Developed by marcklingen, it transforms Langfuse prompts into MCP-compatible formats, supports pagination for prompt listing, and includes a prompt compilation feature. The server also offers tool-based operations for increased compatibility with MCP clients. It's particularly useful for AI applications requiring dynamic prompt management, version control, and integration with existing Langfuse workflows. The implementation focuses on production-labeled prompts and is designed to work seamlessly with Claude Desktop and Cursor environments.",MINIMAL,0.78,1.0,7.4,-2.22,Yes,Yes,Yes,Yes,Yes,Yes,Yes,Yes,Yes,Yes,3354,14,4,5.0,,No,No,,
nguyenvanduocit,all-in-one-model-context-protocol,65,0,"This MCP server, developed by nguyenvanduocit, enables AI assistants like Claude to interact with a wide range of development tools and services. Built in Go, it provides capabilities for searching Confluence, querying GitLab repositories, fetching Jira issues, executing command-line scripts, and more. The implementation stands out by offering a unified interface to multiple essential development platforms and APIs. By connecting AI capabilities with core development workflows and knowledge bases, this server allows AI systems to access documentation, analyze code, track issues, and assist with various development tasks. It is particularly useful for enhancing AI-powered developer tools, automating software development workflows, and building intelligent assistants that can seamlessly integrate with existing development infrastructure.",MINIMAL,0.78,1.0,7.3,-2.19,Yes,Yes,Yes,Yes,Yes,No,Yes,Yes,Yes,Yes,20537,65,4,3.5,error_handling,No,No,,
peakmojo,applescript-mcp,65,524,"AppleScript MCP Server provides a dual-implementation (Node.js and Python) bridge that enables AI assistants to execute AppleScript code on macOS systems. Developed by peakmojo, this lightweight server (<100 lines of core code) allows interaction with Mac applications and system features including Notes, Calendar, Contacts, Messages, Finder, and more. The implementation handles script execution through temporary files and subprocess calls, with configurable timeouts and comprehensive error handling. It's particularly valuable for automating Mac-specific tasks like creating reminders, searching files, checking system status, or controlling applications through natural language requests.",MINIMAL,0.35,1.0,5.1,-1.53,Yes,Yes,Yes,No,No,No,Yes,Yes,Yes,Yes,2307,7,17,5.0,configuration; api_reference; error_handling,Yes,No,,
philliprt,think-mcp-server,65,0,"Think Tool MCP Server implements Anthropic's 'think' tool as described in their engineering blog, providing Claude with a dedicated space for structured reasoning during complex problem-solving tasks. This TypeScript implementation creates a simple MCP server that allows Claude to pause and reflect during response generation, without performing external actions or retrieving new information. Research shows this approach improves performance by up to 54% on complex tasks, especially when working with multiple tools or following detailed policies, making it particularly valuable for customer service, legal compliance, sequential decision-making, and coding challenges.",MINIMAL,0.78,1.0,7.3,-2.19,Yes,Yes,Yes,Yes,No,Yes,Yes,Yes,Yes,Yes,6732,15,8,5.0,project_info,No,No,,
quantgeekdev,coincap-mcp,65,7015,"This MCP server, developed by QuantGeekDev, provides access to cryptocurrency data from the CoinCap API without requiring API keys or registration. It exposes tools for querying Bitcoin prices, retrieving prices for any supported cryptocurrency, and listing all available crypto assets. By integrating with CoinCap's public API, this implementation enables AI assistants to easily incorporate up-to-date cryptocurrency information into their responses. It is particularly useful for financial analysis, market tracking, and generating reports on crypto trends through natural language queries to an AI assistant.",MINIMAL,1.21,1.4,6.2,-1.86,Yes,Yes,Yes,Yes,Yes,No,Yes,Yes,Yes,Yes,1989,13,6,5.0,error_handling; project_info,No,No,,
tanigami,mcp-server-perplexity,65,14151,"This MCP server, developed by tanigami, provides seamless integration with the Perplexity API for AI assistants. Built for use with Claude Desktop, it offers a tool for requesting chat completions with citations from Perplexity. The server bridges Claude's capabilities with Perplexity's advanced language models and real-time information retrieval, enabling more up-to-date and factual responses. Key features include citation support and easy configuration through Claude Desktop settings. By leveraging Perplexity's strengths in current events and factual queries, this implementation enhances AI capabilities for tasks requiring recent information or verified sources. It is particularly useful for scenarios like research assistance, fact-checking, or generating responses with reliable citations.",MINIMAL,1.27,1.6,5.7,-1.71,Yes,Yes,No,Yes,No,Yes,Yes,Yes,Yes,Yes,1184,6,1,5.0,usage,No,Yes,,
vinayak-mehta,mcp-browser-use,65,16204,"The MCP Browser-Use server connects any MCP client (like Claude or Cursor) with the browser-use library, allowing AI assistants to interact with web browsers. Unlike other browser-use MCPs that require purchasing a separate LLM API key, this implementation by Vinayak Mehta leverages the LLM already configured in your MCP client. It enables web browsing capabilities through a simple command (uvx mcp-browser-use) that can be added to MCP client configurations, making it ideal for users who want to give their AI assistants web access without additional API costs.",MINIMAL,1.44,1.6,5.4,-1.62,Yes,Yes,Yes,Yes,Yes,No,Yes,Yes,Yes,Yes,1426,5,1,3.5,error_handling,No,No,,
rootly-ai-labs,rootly-mcp-server,64,5363,"Rootly MCP Server provides a dynamic interface to the Rootly API for incident management directly within MCP-compatible editors like Cursor, Windsurf, and Claude. Developed by Rootly AI Labs, it transforms Rootly's OpenAPI specification into MCP tools that enable users to resolve production incidents without leaving their IDE. The server intelligently limits exposed API paths to prevent AI agent overwhelm, focusing on core incident management endpoints with default pagination to prevent context window overflow. This implementation is particularly valuable for SRE teams and developers who need to quickly respond to and manage production incidents while staying in their development environment.",HIGH,-2.48,1.4,7.2,-2.16,Yes,Yes,Yes,Yes,Yes,No,Yes,Yes,Yes,Yes,3127,6,3,5.0,error_handling,No,Yes,Found pattern: send.*data; Found pattern: tracking; Found pattern: collect.*data; Potential data exfiltration: send.*data; Potential data exfiltration: log.*queries,https://api.rootly.com/v1/alert_events/%7Bid%7D\; https://api.rootly.com/v1/alert_urgencies/%7Bid%7D; https://api.rootly.com/v1/form_set_conditions/%7Bid%7D\; https://api.rootly.com/v1/escalation_paths/%7Bescalation_policy_path_id%7D/escalation_levels; https://api.rootly.com/v1/incidents/%7Bincident_id%7D/status-page-events?include=SOME_STRING_VALUE&page%5Bnumber%5D=SOME_INTEGER_VALUE&page%5Bsize%5D=SOME_INTEGER_VALUE
roychri,mcp-server-asana,64,7442,"This Asana MCP server, developed by Christian Roy, enables AI assistants to interact with the Asana project management platform. It provides a comprehensive set of tools for managing workspaces, projects, tasks, comments, and dependencies through the Asana API. The implementation abstracts Asana's functionality, offering a standardized interface for AI systems to perform project management operations. By connecting AI assistants with Asana, this server facilitates task automation, project tracking, and team collaboration. It is particularly useful for AI applications requiring seamless integration with Asana, such as automated project updates, task prioritization, or intelligent workload management across teams and projects.",MINIMAL,0.68,1.4,7.4,-2.22,Yes,Yes,Yes,Yes,Yes,Yes,Yes,Yes,Yes,Yes,15724,10,3,3.5,,Yes,No,,
lsd-so,lsd-mcp,63,0,"This MCP server, developed by LSD.so, enables Claude to directly query and analyze web content using LSD SQL, a domain-specific language for web scraping. Built with Python and leveraging cloud browsers, it allows Claude to write and execute LSD SQL queries to extract structured data from websites. The implementation focuses on providing a flexible interface for web data extraction, including features like parallel processing and just-in-time table creation. It's particularly useful for applications requiring real-time web data analysis, enabling use cases such as market research, competitor analysis, and content aggregation without complex web scraping setups or API integrations.",MINIMAL,0.73,1.0,7.8,-2.34,Yes,Yes,Yes,Yes,Yes,Yes,Yes,Yes,Yes,Yes,8269,16,9,5.0,,No,Yes,,
tacticlaunch,mcp-linear,63,4193,"MCP Linear is a server implementation that bridges AI assistants with the Linear project management system, enabling natural language interaction with Linear's GraphQL API. Developed by tacticlaunch, it provides tools for managing issues, projects, teams, cycles, and users through a standardized interface. The server authenticates with Linear using an API token and translates assistant requests into appropriate API calls, handling everything from creating and updating issues to managing project workflows and team assignments. Particularly valuable for teams who want to integrate project management tasks directly into their AI assistant workflows without context switching.",MINIMAL,0.9,1.2,6.8,-2.04,Yes,Yes,Yes,Yes,Yes,No,Yes,Yes,Yes,Yes,4176,16,6,5.0,error_handling,No,Yes,,
donghao1393,mcp-dbutils,62,67219,"MCP Database Utilities is a unified database access service that supports multiple database types (PostgreSQL, SQLite, and MySQL). Through its abstraction layer design, it provides a simple and unified database operation interface for MCP servers.",MINIMAL,1.58,1.8,6.0,-1.8,Yes,Yes,Yes,Yes,Yes,No,No,No,Yes,Yes,4327,15,0,3.5,error_handling,No,No,Found pattern: fetch\s*\(,https://sonarcloud.io/project/issues?id=${projectKey; https://sonarcloud.io/api/ce/task?id=${ceTaskId; https://sonarcloud.io/dashboard?id=${projectKey; https://sonarcloud.io/api/issues/search?componentKeys=${projectKey; https://sonarcloud.io/api/measures/component?component=${projectKey
fengin,search-server,62,0,"Search-Server provides a unified interface for AI assistants to access multiple search engines through a standardized API. The implementation integrates with Brave Search, Metaso, and Bocha search services, handling authentication, rate limiting, and response formatting for each provider. Built with Python and modern async libraries like httpx, aiohttp, and Playwright, it abstracts away the complexity of different search APIs while maintaining provider-specific features. This server is particularly valuable for developers who need to incorporate web search capabilities into AI applications without managing multiple search engine integrations separately.",MINIMAL,0.69,1.0,6.4,-1.92,Yes,Yes,Yes,Yes,Yes,Yes,Yes,Yes,Yes,Yes,6818,31,10,3.5,project_info,No,Yes,,
jdubois,azure-cli-mcp,62,0,"Azure CLI MCP is a server implementation that wraps the Azure CLI, enabling AI assistants to execute Azure commands through a standardized interface. Developed by Julien Dubois, it uses Spring Boot and Spring AI to expose Azure CLI functionality via the stdio transport, allowing users to manage Azure resources directly from tools like Claude Desktop or VS Code. The server runs locally using the user's Azure credentials and includes a carefully crafted prompt that improves how LLMs interact with Azure, making it particularly effective for listing resources, fixing configuration issues, and creating new Azure services.",MINIMAL,0.79,1.0,7.0,-2.1,Yes,Yes,Yes,Yes,Yes,No,Yes,Yes,Yes,Yes,8053,15,5,5.0,error_handling,No,No,,
secretiveshell,mcp-searxng,62,8401,"This MCP server, developed by SecretiveShell, enables AI assistants like Claude to perform web searches using the SearXNG metasearch engine. Built in Python, it provides a simple interface for querying SearXNG and retrieving search results. The implementation stands out by leveraging SearXNG's privacy-focused approach and ability to aggregate results from multiple search engines. By connecting AI capabilities with a customizable search backend, this server allows AI systems to access up-to-date web information while maintaining user privacy. It is particularly useful for enhancing AI assistants with real-time web search capabilities, conducting research tasks, or building applications that require privacy-preserving internet queries.",MINIMAL,1.28,1.4,4.1,-1.23,Yes,No,Yes,No,No,No,Yes,Yes,Yes,No,1513,7,3,3.5,installation; api_reference; error_handling; license; project_info,No,No,,
isaacwasserman,mcp-snowflake-server,61,0,"This MCP server, developed by Isaac Wasserman, enables AI assistants like Claude to interact with Snowflake databases. Built in Python, it provides capabilities for executing SQL queries, managing database schema, and maintaining a dynamic insights memo. The implementation stands out by offering a standardized interface to Snowflake's powerful data warehousing capabilities, allowing AI systems to analyze and manipulate large-scale datasets. By connecting AI capabilities with enterprise data infrastructure, this server enables AI assistants to perform complex data analysis, generate insights, and interact with business intelligence workflows. It is particularly useful for data exploration tasks, automated reporting, and building AI-powered analytics tools that can leverage the full power of Snowflake's cloud data platform.",MINIMAL,0.78,1.0,7.3,-2.19,Yes,Yes,Yes,Yes,Yes,Yes,Yes,Yes,Yes,Yes,5420,16,6,5.0,,No,No,,
sammcj,mcp-package-docs,61,7780,"This MCP server, developed by Sam McLeod, provides efficient access to package documentation across multiple programming languages. Built with TypeScript and Node.js, it supports Go packages via 'go doc', Python libraries using built-in 'help()', and NPM packages through registry documentation. The server implements smart parsing to deliver structured output with descriptions, usage, and examples, while maintaining a minimal memory footprint through built-in caching. By offering a standardized interface for package documentation retrieval, it enables AI models to quickly access and utilize up-to-date library information. This implementation is particularly useful for developers and AI assistants working on multi-language projects, code analysis tasks, and automated documentation generation.",MINIMAL,1.17,1.4,7.8,-2.34,Yes,Yes,Yes,Yes,Yes,Yes,Yes,Yes,Yes,Yes,8823,24,15,5.0,,No,No,,https://pkg.go.dev/api/packages/${encodeURIComponent(packageName; https://raw.githubusercontent.com/${repoPath; https://pypi.org/pypi/${packageName; https://raw.githubusercontent.com/${owner; https://unpkg.com/@types/${packageName
silenceper,mcp-k8s,61,0,"mcp-k8s is a Kubernetes MCP server that enables AI assistants to interact with Kubernetes clusters through natural language. Built in Go using the mcp-go SDK and Kubernetes client-go library, it provides tools for querying resource types and performing CRUD operations on Kubernetes resources with configurable write permissions. The server connects to clusters using kubeconfig and supports both read-only and write operations (create/update/delete) that can be independently enabled or disabled for security. Particularly valuable for interactive resource management, automated operations, development support, and educational scenarios where users benefit from natural language interaction with Kubernetes environments.",MINIMAL,0.77,1.0,7.8,-2.34,Yes,Yes,Yes,Yes,Yes,Yes,Yes,Yes,Yes,Yes,9616,35,6,5.0,,No,No,,
tencentedgeone,edgeone-pages-mcp,61,11429,"EdgeOne Pages MCP server enables rapid deployment of HTML content to Tencent's EdgeOne Pages service. The server integrates with EdgeOne Pages Functions and KV store to host static content at the edge, providing a simple interface for deploying HTML and obtaining publicly accessible URLs. Built for developers who need quick content publishing capabilities through AI assistants, it handles API errors gracefully and returns immediate access to deployed content.",MINIMAL,1.42,1.6,5.9,-1.77,Yes,No,Yes,Yes,No,Yes,Yes,Yes,Yes,Yes,2642,9,2,5.0,installation,No,No,,
xing5,mcp-google-sheets,61,9343,"This MCP server integrates with Google Drive and Google Sheets, enabling AI assistants to create, read, update, and manage spreadsheets. Built by Xing Wu, it provides tools for retrieving sheet data, updating cells, adding rows and columns, creating new spreadsheets, and listing available documents. The implementation supports both OAuth and service account authentication methods, making it suitable for personal assistants that need to interact with spreadsheet data or automate document workflows without requiring users to switch contexts.",MINIMAL,0.67,1.4,7.6,-2.28,Yes,Yes,Yes,Yes,Yes,Yes,Yes,Yes,Yes,Yes,18301,18,13,3.5,,Yes,No,,
baranwang,mcp-trends-hub,60,3793,"MCP Trends Hub provides AI assistants with access to trending topics and content from popular Chinese platforms including Weibo, Zhihu, Douyin, Bilibili, Douban, Toutiao, and 36kr. The implementation exposes each platform as a separate tool that fetches current trending data, with results cached temporarily to improve performance. Built with TypeScript and using the Model Context Protocol SDK, it features robust error handling and standardized response formatting. This server is particularly valuable for use cases requiring real-time insights into Chinese social media trends, content discovery, and cultural monitoring without leaving the conversation interface.",MINIMAL,1.02,1.2,5.9,-1.77,Yes,Yes,Yes,Yes,No,No,Yes,Yes,Yes,Yes,3944,13,5,5.0,configuration; error_handling,No,No,,https://post.smzdm.com/rank/json_more; https://sspai.com/api/v1/article/tag/page/get; https://gateway.36kr.com/api/mis/nav/home/nav/rank/${type; https://api.bilibili.com/x/web-interface/ranking/v2?rid=${type; https://weread.qq.com/web/bookDetail/${wereadID
dfkai,xtquantai,60,0,"A lightweight MCP server for quantitative trading using the XTQuant API, enabling AI-driven financial analysis and trading strategies. Developed by davidfnck, this tool provides a Python-based integration for programmatic stock market interactions, with a focus on leveraging AI capabilities for quantitative investment approaches.",MINIMAL,0.85,1.0,5.0,-1.5,Yes,Yes,No,No,No,No,Yes,Yes,Yes,Yes,3244,30,12,5.0,usage; configuration; api_reference; error_handling,No,No,,http://localhost:{port
f4ww4z,mcp-mysql-server,60,15455,"This MCP MySQL server, developed by f4ww4z, enables AI assistants like Claude to interact with MySQL databases through a standardized interface. Built in JavaScript/TypeScript, it provides capabilities for executing queries, managing database connections, and retrieving schema information. The implementation stands out by offering prepared statement support, automatic connection management, and comprehensive error handling. By connecting AI capabilities with relational database operations, this server allows AI systems to query and manipulate data in MySQL databases programmatically. It is particularly useful for building AI-powered data analysis tools, automated reporting systems, and intelligent assistants that need to interact with MySQL-based applications and data stores.",MINIMAL,1.38,1.6,7.2,-2.16,Yes,Yes,Yes,Yes,Yes,Yes,Yes,Yes,Yes,Yes,3442,16,9,5.0,,No,No,,
meterlong,mcp-doc,60,0,"DocxProcessor MCP server provides a comprehensive Word document processing service that enables AI assistants to create, edit, and manipulate Microsoft Word documents through a rich set of tools. Built using Python with the python-docx library, it offers functionality for adding and formatting text, managing tables, searching and replacing content, and preserving document styling. The implementation includes state management for maintaining document sessions across server restarts and detailed error handling, making it particularly valuable for workflows requiring document generation, content editing, or template-based document creation without leaving the conversation interface.",MINIMAL,0.8,1.0,6.5,-1.95,Yes,Yes,Yes,Yes,No,Yes,Yes,Yes,Yes,Yes,4198,12,1,3.5,,No,No,,
portswigger,mcp-server,60,0,"Burp Suite MCP Server enables AI clients to interact with Burp Suite's web security testing capabilities through the Model Context Protocol. Developed by PortSwigger, this Kotlin-based extension exposes Burp's functionality as tools that AI assistants can use to send HTTP requests, analyze proxy history, manipulate Burp's configuration, and perform various security testing operations. The server includes automatic installation support for Claude Desktop through a packaged stdio proxy server, making it particularly valuable for security professionals who want to leverage AI assistance for web application security testing, vulnerability assessment, and penetration testing workflows.",MINIMAL,0.81,1.0,6.4,-1.92,Yes,Yes,Yes,Yes,No,No,Yes,Yes,Yes,No,5652,15,7,5.0,error_handling; license,No,No,,
tinybirdco,mcp-tinybird,60,20469,"This MCP server, developed by Tinybird, enables AI assistants to interact with Tinybird workspaces for data exploration and analysis. Built in Python, it provides tools for querying data sources, executing API endpoints, and pushing data files. The server leverages Tinybird's real-time analytics capabilities, allowing AI models to access and analyze large datasets efficiently. Key features include SQL query execution, data source exploration, and integration with Tinybird's documentation. By bridging AI assistants with powerful analytics infrastructure, this implementation is particularly useful for tasks involving data-driven insights, business intelligence, and real-time data exploration across various domains.",MINIMAL,1.37,1.6,7.8,-2.34,Yes,Yes,Yes,Yes,Yes,Yes,Yes,Yes,Yes,Yes,7281,18,12,5.0,,No,No,,
voska,hass-mcp,60,0,"Hass-MCP enables AI assistants like Claude to interact directly with Home Assistant smart home systems through the Model Context Protocol. Built by Matt Voska, it provides tools for querying device states, controlling lights and switches, summarizing smart home configurations, troubleshooting automations, and searching for specific entities. The implementation runs as a Docker container that communicates with Home Assistant via its API, making it ideal for users who want to manage their smart home through natural language conversations without leaving their AI assistant interface.",MINIMAL,0.78,1.0,7.5,-2.25,Yes,Yes,Yes,Yes,Yes,Yes,Yes,Yes,Yes,Yes,6590,18,5,3.5,,No,No,,
waldzellai,waldzell-mcp,60,0,"The MCP Servers repository by Waldzell AI provides a collection of specialized MCP servers for different use cases. It includes server-typestyle for Google TypeScript style guide analysis, server-yelp-fusionai for Yelp Fusion API integration with business search and review capabilities, server-clear-thought for systematic thinking and mental models, and server-stochasticthinking for probabilistic decision-making algorithms. Each server is containerized with Docker, configured for Smithery deployment, and follows a consistent architecture pattern with TypeScript implementation. The monorepo structure enables shared utilities while maintaining independent versioning through changesets.",MINIMAL,0.81,1.0,6.3,-1.89,Yes,Yes,Yes,Yes,No,No,Yes,Yes,Yes,Yes,3604,23,9,5.0,configuration; error_handling,Yes,Yes,,https://api.yelp.com; https://yelp.com/events/featured-event-id; https://example.com/callback; https://yelp.com/events/test-event-id; http://localhost:${EXA_SERVER_PORT
