owner,repo,github_stars,download_count,experimental_ai_generated_description,risk_category,adjusted_risk_score,popularity_score,doc_quality_score,doc_quality_adjustment,readme_found,has_installation_docs,has_usage_docs,has_api_reference,has_security_docs,has_error_handling,has_cli_docs,has_code_examples,has_screenshots,has_license_info,readme_size_bytes,headings_count,code_blocks_count,readability_score,missing_sections,oauth_implementation,direct_api_tokens,main_risk_factors,outbound_connections
daipendency,daipendency-mcp,53,0,"This MCP server, developed by Gus Narea, provides a standardized interface for extracting documentation and public API information from dependencies in local projects. Built with TypeScript and leveraging the Model Context Protocol SDK, it offers a tool called 'get_dependency_docs' that simplifies the process of retrieving dependency documentation. The implementation focuses on enhancing developer productivity by automating the extraction of dependency information, which is particularly useful for projects with complex dependency structures. It's designed for developers and AI agents working on code analysis, documentation generation, or dependency management tasks, enabling use cases such as automated code review, intelligent API suggestions, and streamlined project documentation without manually navigating through dependency files.",MINIMAL,0.9,1.0,3.5,-1.05,Yes,Yes,No,Yes,No,No,Yes,No,Yes,No,783,6,0,5.0,usage; configuration; error_handling; license; project_info,No,No,,
jayzeedesign,figma-mcp,52,17434,"Figma MCP allows AI coding agents to directly access Figma files and prototypes, bridging the gap between design and development workflows. Created by Jason Zhou, this Python-based implementation provides a server that connects to the Figma API using your personal API key. It's designed for seamless integration with Cursor and other MCP-compatible IDEs, enabling AI assistants to reference design files when generating code or answering queries about UI implementations.",MINIMAL,1.24,1.6,4.8,-1.44,Yes,Yes,No,Yes,No,No,Yes,Yes,Yes,No,1297,6,6,3.5,usage; error_handling; license,No,Yes,,"https://www.figma.com/proto/do4pJqHwNwH1nBrrscu6Ld/Untitled?page-id=0%3A1&node-id=0-3&viewport=361%2C361%2C0.08&t=9SVttILbgMlPWuL0-1&scaling=min-zoom&content-scaling=fixed&starting-point-node-id=0%3A3,; https://api.figma.com/v1/files/{file_key"
marcelmarais,spotify-mcp-server,52,0,"Spotify MCP Server enables AI assistants like Claude and Cursor to control Spotify playback and manage playlists through the Model Context Protocol. Built by Marcel Marais, it provides a comprehensive set of tools for both reading operations (searching tracks, viewing playlists, getting currently playing tracks) and playback/creation operations (playing music, creating playlists, adding tracks). The implementation authenticates with the Spotify API using OAuth, automatically refreshes tokens when needed, and runs as a lightweight stdio server that can be easily integrated with Claude Desktop or Cursor for seamless music control during conversations.",MINIMAL,0.29,1.0,7.0,-2.1,Yes,Yes,Yes,Yes,Yes,No,Yes,Yes,Yes,Yes,10039,12,8,5.0,error_handling,Yes,No,,https://accounts.spotify.com/authorize?${authParams.toString(; http://localhost:${port; https://accounts.spotify.com/api/token; http://127.0.0.1:8888/callback
rawveg,ollama-mcp,52,3295,"This MCP server, developed by tigreen, provides a seamless integration between Ollama's local LLM models and MCP-compatible applications like Claude Desktop. Built with TypeScript and Express, it offers tools for listing, pulling, and interacting with Ollama models through a standardized interface. The implementation focuses on simplifying access to Ollama's capabilities, enabling AI assistants to utilize locally-run language models. By connecting AI models with Ollama's functionalities, this server allows for sophisticated scenarios like on-premise AI processing, custom model deployment, and privacy-focused applications. It's particularly valuable for developers and organizations looking to leverage local LLM capabilities within their AI workflows while maintaining data control and reducing cloud dependencies.",MINIMAL,1.0,1.2,6.8,-2.04,Yes,Yes,Yes,Yes,Yes,No,Yes,Yes,Yes,Yes,4000,14,9,5.0,error_handling,No,No,,
reading-plus-ai,mcp-server-deep-research,52,0,"A deep research MCP server that enables AI assistants to conduct thorough, structured investigations on complex topics. It guides the research process through a systematic approach: elaborating on the research question, generating focused subquestions, performing web searches, and synthesizing findings into a comprehensive report. The server maintains a record of the research process and collected data, making them available as resources. Developed by ReadingPlus.AI, this implementation is particularly valuable for educational contexts, academic research, and professional report generation where well-cited, properly formatted research outputs are needed.",MINIMAL,0.79,1.0,7.0,-2.1,Yes,Yes,Yes,Yes,Yes,No,Yes,Yes,Yes,Yes,3258,13,6,5.0,error_handling,No,No,,
vidhupv,x-mcp,52,3919,"This MCP server, developed by vidhupv, enables AI assistants like Claude to create, manage, and publish posts on X/Twitter directly. Built in Python, it provides a simple interface for composing tweets, creating threads, managing drafts, and publishing content. The implementation stands out by offering seamless integration with the X/Twitter API, allowing AI systems to interact with the social media platform programmatically. By connecting AI capabilities with Twitter's functionality, this server enables AI assistants to engage in social media management tasks. It is particularly useful for automating social media workflows, scheduling posts, analyzing engagement, and building AI-powered social media management tools.",MINIMAL,1.01,1.2,6.4,-1.92,Yes,Yes,Yes,Yes,Yes,Yes,Yes,Yes,Yes,Yes,2633,6,4,5.0,,Yes,Yes,,
xzq-xu,jvm-mcp-server,52,0,"JVM MCP Server provides a bridge between Claude and Java Virtual Machine applications, enabling direct interaction with running Java processes through Arthas diagnostic tools. Built with Python and Paramiko for SSH connectivity, it allows AI agents to execute commands, monitor performance, and debug Java applications remotely. The implementation connects to target JVM instances via SSH, manages connection pooling, and exposes Arthas capabilities as MCP tools, making it particularly valuable for developers who need to diagnose and troubleshoot Java applications without leaving their AI assistant conversation.",MINIMAL,0.8,1.0,6.8,-2.04,Yes,Yes,Yes,Yes,Yes,No,Yes,Yes,Yes,Yes,3716,24,8,5.0,error_handling,No,No,,
mattzcarey,mcp-thinking,51,0,"This MCP thinking server, developed by Matt Carey, extracts the reasoning chain from the Deepseek R1 model and makes it available to Claude Desktop and other MCP clients. Built with TypeScript and leveraging the Model Context Protocol SDK, it provides a bridge between Deepseek's API and MCP-compatible applications. The implementation focuses on exposing Deepseek R1's step-by-step reasoning capabilities through a standardized interface. It's particularly useful for developers and researchers looking to incorporate Deepseek's advanced reasoning into their workflows, enabling use cases like complex problem-solving, decision analysis, and explainable AI without directly interacting with Deepseek's API.",MINIMAL,0.65,1.0,4.9,-1.47,Yes,Yes,Yes,Yes,Yes,No,Yes,Yes,Yes,No,837,4,4,3.5,error_handling; license; project_info,No,Yes,,
mobilehackinglab,jadx-mcp-plugin,51,0,"The jadx-mcp-plugin is a powerful extension for the popular Jadx decompiler that exposes the internal decompiled code structure through the Model Context Protocol (MCP)  a structured API designed to facilitate programmatic access and interaction with the decompiled codebase.

This plugin transforms Jadx into an AI-friendly analysis environment, making it easier to:

Navigate code programmatically: AI tools and scripts can query classes, methods, and fields using structured requests, removing the need for brittle regex-based parsing.

Automate analysis tasks: Streamline repetitive reverse engineering workflows by integrating AI agents or scripts that can reason over the code and metadata.

Power intelligent reverse engineering: Combine with LLMs or AI frameworks to build automated code summarizers, vulnerability scanners, or Android deobfuscators.

 Use Case in AI Reverse Engineering AI models, such as Claude, GPT-40 or domain-specific agents, can use the MCP API to:

Extract call graphs or class hierarchies for architectural analysis.

Auto-document code by interpreting class roles and method behaviors.

Search and highlight suspicious patterns (e.g., dynamic loading, reflection).

       :
- ""              ""

- ""                    ""

- ""       ""

Whether you're building a smarter reverse engineering assistant or just want more structured control over Jadx outputs, jadx-mcp-plugin is your gateway to the future of AI-augmented reverse engineering.",MINIMAL,0.79,1.0,7.0,-2.1,Yes,Yes,Yes,Yes,Yes,No,Yes,Yes,Yes,No,5251,17,11,5.0,error_handling; license,No,No,,http://localhost:8085
block,vscode-mcp,50,6973,"The VS Code MCP Server enables AI assistants to interact directly with VS Code through a bidirectional communication channel. It provides tools for file diffing with user approval, opening files and projects, executing shell commands in VS Code's terminal, and retrieving information about active editor tabs. The implementation consists of two main components: a server that handles MCP protocol communication and a VS Code extension that provides native integration features. This allows AI agents to perform code modifications, navigate projects, and execute commands without leaving the conversation interface, making it particularly valuable for collaborative coding sessions and AI-assisted development workflows.",MINIMAL,1.25,1.4,4.9,-1.47,Yes,Yes,No,No,No,No,Yes,Yes,Yes,Yes,2015,14,3,5.0,usage; api_reference; error_handling,No,No,,
cyanheads,git-mcp-server,50,0,"This Git MCP server provides AI assistants with capabilities to interact with Git repositories. Developed as an open-source project, it integrates with the simple-git library to enable core Git operations like cloning, committing, and managing branches. The server exposes a standardized interface for Git interactions, abstracting the complexities of version control operations. By leveraging TypeScript and following modern JavaScript practices, it offers a robust and type-safe implementation. This server is particularly useful for developers and DevOps teams looking to incorporate AI-driven Git operations into their workflows, such as automated code reviews, commit analysis, or intelligent branching strategies.",MINIMAL,0.77,1.0,7.8,-2.34,Yes,Yes,Yes,Yes,Yes,Yes,Yes,Yes,Yes,Yes,18232,35,9,5.0,,No,No,,
daniel-lxs,mcp-perplexity,50,33107,"This MCP server, developed by Daniel Riccio, provides integration with the Perplexity API for advanced language understanding and generation. Built with Python and leveraging the MCP framework, it offers two main tools: ask_perplexity for expert programming assistance and chat_perplexity for ongoing conversations. The implementation focuses on maintaining chat history, supporting different Perplexity models, and providing streaming responses with progress reporting. It's particularly useful for developers and teams who want to incorporate Perplexity's language capabilities into their workflows, enabling use cases such as code debugging, technical explanations, and persistent AI-assisted conversations without directly managing API calls to Perplexity.",MINIMAL,1.33,1.6,7.7,-2.31,Yes,Yes,Yes,Yes,Yes,Yes,Yes,Yes,Yes,Yes,7299,23,5,5.0,,No,Yes,,
ramxx,mcp-tavily,50,31088,"This MCP server, developed by RamXX, provides AI-powered web search capabilities using Tavily's search API. It enables AI assistants like Claude to perform web searches, get direct answers to questions, and search recent news articles with relevant content extraction. The server exposes three main tools: comprehensive web search, answer generation with supporting evidence, and news article search. By integrating Tavily's AI-enhanced search functionality, this implementation facilitates more informed and up-to-date interactions. It is particularly useful for research tasks, fact-checking, generating reports, and staying current on specific topics through natural language queries to an AI assistant.",MINIMAL,1.33,1.6,7.6,-2.28,Yes,Yes,Yes,Yes,Yes,Yes,Yes,Yes,Yes,Yes,10489,26,22,3.5,,No,Yes,,
shenghaiwang,xcodebuild,50,6159,"This MCP server implementation provides tools for building and testing iOS Xcode projects. Developed by Tim Wang, it offers capabilities to build iOS Xcode workspaces/projects and run tests, sending errors back to the LLM. The server is designed for seamless integration with Visual Studio Code extensions like Cline or Roo Code, enabling efficient iOS development workflows and automated error handling in AI-assisted coding environments.",MINIMAL,1.23,1.4,5.6,-1.68,Yes,Yes,Yes,No,No,No,Yes,Yes,Yes,Yes,1834,8,4,5.0,api_reference; error_handling; project_info,No,No,,
henryhawke,mcp-titan,49,0,"This MCP server, developed by Henry Hawke, provides enhanced Titan Memory capabilities for AI agents. Built with TypeScript and leveraging TensorFlow.js, it offers improved context retention and retrieval through neural network-based memory encoding. The implementation focuses on optimizing long-term information storage and recall for conversational AI, enabling more coherent and contextually-aware interactions. It's particularly useful for applications requiring persistent memory across multiple conversations or complex, multi-step tasks where traditional context windows fall short.",MINIMAL,0.78,1.0,7.4,-2.22,Yes,Yes,Yes,Yes,Yes,Yes,Yes,Yes,Yes,Yes,5160,24,2,5.0,,No,No,,
fdrechsler,mcp-server-idapro,49,0,"IDA Pro MCP server enables AI assistants to interact with IDA Pro for reverse engineering and binary analysis tasks. Created by Florian Drechsler, it provides a secure bridge between AI and IDA Pro through a remote control plugin that exposes key functionality like script execution, string/function analysis, and disassembly via HTTP endpoints. The implementation features robust error handling, automatic dialog suppression, and timeouts to ensure stable operation when automating IDA Pro tasks, making it valuable for security researchers and reverse engineers who want to leverage AI assistance while analyzing binaries.",MINIMAL,0.77,1.0,7.6,-2.28,Yes,Yes,Yes,Yes,Yes,No,Yes,Yes,Yes,Yes,7796,29,16,5.0,error_handling,No,No,,http://{host; http://{self.host; http://{DEFAULT_HOST
joenorton,comfyui-mcp-server,49,0,"This MCP server implementation provides a bridge between ComfyUI and MCP clients for image generation tasks. It uses WebSockets for communication, allowing clients to send image generation requests with customizable parameters like prompt, width, and height. The server processes these requests through ComfyUI and returns the generated image URL. It's designed for easy integration into applications requiring on-demand AI image generation capabilities.",MINIMAL,0.81,1.0,6.3,-1.89,Yes,Yes,Yes,Yes,No,No,Yes,Yes,Yes,Yes,2781,9,3,3.5,error_handling,No,No,,http://localhost:8188
darkroaster,pubmearch,49,0,"PubMed Analysis MCP Server enables AI assistants to search, retrieve, and analyze scientific literature from PubMed. It leverages the Biopython library to access NCBI's Entrez API, providing structured article data including titles, authors, abstracts, and keywords. The server includes robust analysis capabilities for identifying research hotspots, tracking publication trends over time, and generating comprehensive statistical reports - making it valuable for researchers, academics, and healthcare professionals who need to quickly extract insights from medical literature.",MINIMAL,0.67,1.0,5.8,-1.74,Yes,Yes,Yes,Yes,No,No,Yes,Yes,Yes,No,3292,15,2,3.5,error_handling; license,No,Yes,,
quazaai,unitymcpintegration,49,0,"Unity MCP Integration enables AI assistants to understand and interact with Unity projects in real-time through a WebSocket-based communication system. It provides tools for retrieving scene hierarchies, project settings, and executing C# code directly in the Unity Editor. The implementation includes both a Unity Editor plugin with a debug window and a Node.js server component that implements the Model Context Protocol, making it particularly valuable for AI-assisted game development workflows.",MINIMAL,0.78,1.0,7.5,-2.25,Yes,Yes,Yes,Yes,Yes,Yes,Yes,Yes,Yes,Yes,7883,20,4,3.5,,No,No,,
shannonlal,mcp-postman,49,1304,"This MCP Postman server, developed using TypeScript and leveraging the Newman library, provides a standardized interface for running Postman collections via the Model Context Protocol. It offers tools for executing API tests, validating responses, and generating reports based on Postman collection runs. The server integrates seamlessly with existing Postman workflows, abstracting the complexities of collection execution into a consistent MCP interface. By enabling AI systems to interact with and analyze API test results, this implementation facilitates use cases such as automated API testing, continuous integration pipelines, and API documentation generation. The server is designed for easy deployment and configuration, making it valuable for developers and QA teams building AI-powered tools that interact with API test data.",MINIMAL,0.5,1.2,6.7,-2.01,Yes,Yes,Yes,Yes,No,No,Yes,Yes,Yes,Yes,3460,23,7,5.0,error_handling,Yes,No,,http://localhost:${PORT; https://api.coindesk.com/v1/bpi/currentprice.json
spences10,mcp-memory-libsql,49,7878,"This LibSQL-based persistent memory tool for MCP, developed by Scott Spence, provides a database interface for AI models to store and retrieve information. Built with TypeScript and leveraging the LibSQL client, it offers functionality for managing entities and relations in a knowledge graph structure. The implementation focuses on providing a robust, SQL-based storage solution that can be used locally or with remote databases. It's particularly useful for maintaining context across conversations, building knowledge bases, or creating persistent memory systems for AI assistants, enabling long-term information retention without requiring complex database management.",MINIMAL,1.21,1.4,6.3,-1.89,Yes,No,Yes,Yes,Yes,No,Yes,Yes,Yes,Yes,3639,13,7,5.0,installation; error_handling,No,No,,
vectorize-io,vectorize-mcp-server,49,1737,"Vectorize MCP Server provides a bridge between Claude and Vectorize.io's vector database services, enabling advanced retrieval, text extraction, and deep research capabilities. Built with TypeScript, it exposes three primary tools: vector search for retrieving relevant documents from pipelines, text extraction for converting various document formats to Markdown, and deep research for generating comprehensive analyses from document collections. The implementation handles authentication through organization IDs and API tokens, making it particularly valuable for knowledge management, document analysis, and research workflows that require sophisticated vector search capabilities without leaving the conversation interface.",MINIMAL,1.0,1.2,6.5,-1.95,Yes,Yes,No,Yes,Yes,No,Yes,Yes,Yes,Yes,6029,13,9,3.5,usage; error_handling,No,No,,
its-dart,dart-mcp-server,48,7561,"Dart MCP Server provides AI assistants with direct access to Dart's project management platform, enabling task and document management through a comprehensive set of tools. Built by the Dart team, it allows for creating, retrieving, updating, and deleting tasks and documents, with support for filtering by various attributes like assignees, status, and priority. The server exposes both structured tools and resource templates that make it easy for AI assistants to interact with Dart's API, and includes prompts for common actions like creating tasks or summarizing work items. It's particularly valuable for teams using Dart who want to manage their projects directly through AI assistants like Claude without switching contexts.",MINIMAL,1.2,1.4,6.7,-2.01,Yes,Yes,No,Yes,Yes,Yes,Yes,Yes,Yes,Yes,6457,18,2,5.0,usage,No,No,,
ibraheem4,linear-mcp,48,0,"This Linear MCP server provides a bridge between AI assistants and Linear's project management platform. Built with TypeScript and leveraging the Linear SDK, it offers tools for issue, team, and project management. The implementation focuses on simplifying interactions with Linear's API, making it accessible for AI models to create, list, and update issues, as well as retrieve team and project information. It's particularly useful for tasks like automated issue tracking, project status reporting, or integrating task management into AI-driven workflows, enabling assistants to interact with Linear without requiring deep knowledge of the underlying API complexities.",MINIMAL,0.72,1.0,7.5,-2.25,Yes,Yes,No,Yes,Yes,Yes,Yes,Yes,Yes,Yes,5519,21,16,5.0,usage,No,Yes,,
kujenga,zotero-mcp,48,7042,"This MCP server, developed by an unknown author, provides integration with the Zotero reference management system. Built with Python and leveraging the pyzotero library, it offers tools for searching Zotero libraries, retrieving item metadata, and accessing full-text content. The implementation focuses on providing a bridge between AI agents and scholarly research data, with features like formatted metadata output and attachment handling. It's particularly useful for researchers, students, and knowledge workers looking to incorporate their Zotero libraries into AI-assisted workflows, enabling use cases such as literature review automation, citation management, and content summarization without directly interacting with the Zotero API.",MINIMAL,1.1,1.4,6.6,-1.98,Yes,Yes,No,Yes,Yes,No,Yes,Yes,Yes,No,6365,9,7,5.0,usage; error_handling; license,No,Yes,,
martinbowling,thoughtful-claude,48,0,"This FastMCP server implementation integrates DeepSeek's R1 reasoning engine with Claude, enabling advanced reasoning capabilities in MCP-compatible applications. Developed using Python and the FastMCP framework, it leverages DeepSeek's API to process queries and return formatted reasoning outputs. The server focuses on enhancing Claude's thought process by incorporating DeepSeek's large-scale reinforcement learning-based reasoning. It's particularly useful for developers and researchers looking to augment AI assistants with external reasoning capabilities, enabling more complex problem-solving, analysis, and decision-making tasks without requiring direct interaction with DeepSeek's API.",MINIMAL,0.72,1.0,7.3,-2.19,Yes,Yes,Yes,Yes,Yes,Yes,Yes,Yes,Yes,Yes,3797,16,2,5.0,,No,Yes,,
peng-shawn,mermaid-mcp-server,48,7885,"This MCP server implementation converts Mermaid diagrams to PNG images. Developed by Shawn Peng, it uses Puppeteer for high-quality headless browser rendering and supports multiple diagram themes and customizable background colors. The server exposes a single 'generate' tool, making it easy to integrate Mermaid diagram generation into AI-assisted workflows or applications that require visual representation of data structures and processes.",MINIMAL,1.17,1.4,7.8,-2.34,Yes,Yes,Yes,Yes,Yes,Yes,Yes,Yes,Yes,Yes,7526,24,10,5.0,,No,No,,
spences10,mcp-svelte-docs,48,4422,"This MCP Svelte documentation server, developed by Scott Spence, provides an interface for AI assistants to access and query Svelte documentation. Built with TypeScript and leveraging the Model Context Protocol SDK, it offers tools for retrieving and parsing Svelte documentation content. The implementation focuses on efficient documentation access and formatting, making it easier for AI models to assist with Svelte-related queries and tasks. It's particularly useful for developers and AI assistants working with Svelte, enabling quick access to framework documentation, code examples, and best practices without requiring deep knowledge of Svelte's documentation structure or manual searching through web pages.",MINIMAL,0.97,1.2,7.6,-2.28,Yes,Yes,Yes,Yes,Yes,Yes,Yes,Yes,Yes,Yes,11148,40,17,3.5,,No,No,,
matthewhand,mcp-openapi-proxy,47,80764,"This MCP server, developed by Matthew Hand, dynamically exposes REST APIs defined by OpenAPI specifications as MCP tools. Built with Python and leveraging libraries like FastAPI and Pydantic, it offers two operation modes: a low-level mode that registers all API endpoints as separate tools, and a FastMCP mode for simplified exposure of specific endpoints. The implementation focuses on flexibility, allowing users to filter endpoints and customize tool naming. By connecting AI models with any OpenAPI-described API, this server enables seamless integration of external services into MCP-based workflows. It's particularly useful for developers and organizations looking to quickly incorporate diverse APIs into their AI systems without extensive custom coding.",MINIMAL,1.57,1.8,7.6,-2.28,Yes,Yes,Yes,Yes,Yes,Yes,Yes,Yes,Yes,Yes,24983,58,39,3.5,,Yes,Yes,,http://localhost:3000/; https://api.example.com/v1; https://api.apis.guru/v2; https://raw.githubusercontent.com/APIs-guru/openapi-directory/refs/heads/main/APIs/apis.guru/2.2.0/openapi.yaml; https://www.wolframalpha.com/api/v1/llm-api
